{
  "$schema": "../../contracts/change-request.schema.json",
  "artifacts": [
    {
      "after_sha256": "19691a474f8f0e576a095d24f5d6b51fc02cf701236cac47ffaa750a2df3c6a0",
      "before_sha256": "19691a474f8f0e576a095d24f5d6b51fc02cf701236cac47ffaa750a2df3c6a0",
      "owner": "frontend-ui-engineering",
      "source": "canonical"
    },
    {
      "after_sha256": "7edde166a9374f8924505bcfdf332374b9ddee7e7546a86a2f53af67834d3246",
      "before_sha256": "de78ed0b0b9f74e3a7f54bb934993e0628a39c73b543a60345c2d95ff8eccdad",
      "owner": "host-deltas",
      "source": "canonical"
    }
  ],
  "checks": [],
  "disposition": "applied",
  "machine": "local-windows",
  "operation": "deploy-canonical-owner",
  "owners": [
    "frontend-ui-engineering",
    "host-deltas"
  ],
  "phase": "completed",
  "phases": [
    {
      "name": "classify",
      "status": "completed"
    },
    {
      "name": "preflight",
      "status": "completed"
    },
    {
      "name": "canonicalize",
      "status": "completed"
    },
    {
      "name": "render",
      "status": "completed"
    },
    {
      "name": "validate",
      "status": "completed"
    },
    {
      "name": "deploy",
      "status": "completed"
    },
    {
      "name": "verify",
      "status": "completed"
    },
    {
      "name": "receipt",
      "status": "completed"
    }
  ],
  "request_id": "7eb99e0d0c89020447cb5f92c6150a18f4fbcd31ee764800f32bfafa32ba46f6",
  "result": "applied",
  "risk": "low",
  "schema_version": 1,
  "source": {
    "host": "canonical",
    "surface": "fleet"
  }
}
