{
  "$schema": "../../contracts/change-request.schema.json",
  "artifacts": [
    {
      "after_sha256": "485036891805594d75e8d0a07dcd2a80279f7550a003e629c2863fae078c5202",
      "before_sha256": "485036891805594d75e8d0a07dcd2a80279f7550a003e629c2863fae078c5202",
      "owner": "frontend-ui-engineering",
      "source": "canonical"
    },
    {
      "after_sha256": "dca7201eceed1e3f595e4efbb5238a95258a2764e13351db8cf3e05b7cd4b59f",
      "before_sha256": "246077aead63f08a58d453df48a0b28fded945a877429eb7192e81e06a538014",
      "owner": "host-deltas",
      "source": "canonical"
    }
  ],
  "checks": [],
  "disposition": "applied",
  "machine": "local-windows",
  "operation": "deploy-canonical-owner",
  "owners": [
    "frontend-ui-engineering",
    "host-deltas"
  ],
  "phase": "completed",
  "phases": [
    {
      "name": "classify",
      "status": "completed"
    },
    {
      "name": "preflight",
      "status": "completed"
    },
    {
      "name": "canonicalize",
      "status": "completed"
    },
    {
      "name": "render",
      "status": "completed"
    },
    {
      "name": "validate",
      "status": "completed"
    },
    {
      "name": "deploy",
      "status": "completed"
    },
    {
      "name": "verify",
      "status": "completed"
    },
    {
      "name": "receipt",
      "status": "completed"
    }
  ],
  "request_id": "6b9b88b9e9fb156882eb63b5d3a7fdff82e185a74e29210b021d987f6d114b50",
  "result": "applied",
  "risk": "low",
  "schema_version": 1,
  "source": {
    "host": "canonical",
    "surface": "fleet"
  }
}
