{
  "$schema": "../../contracts/change-request.schema.json",
  "artifacts": [
    {
      "after_sha256": "6ffffa6cfb0aff36d6e201f52b8b8f746481ee69ef5ad25c4a9e3ca3eca35689",
      "before_sha256": "6ffffa6cfb0aff36d6e201f52b8b8f746481ee69ef5ad25c4a9e3ca3eca35689",
      "owner": "instruction-authoring",
      "source": "canonical"
    },
    {
      "after_sha256": "5eefef3281315aa0f8e777cb9d3bb8dad166f38fb87e3ba282cf0d4394ae73cf",
      "before_sha256": "ef708638aa13819c00cde505c0e77d75ae1215e052490c69de579404d371bbba",
      "owner": "host-deltas",
      "source": "canonical"
    }
  ],
  "checks": [],
  "disposition": "applied",
  "machine": "local-windows",
  "operation": "deploy-canonical-owner",
  "owners": [
    "instruction-authoring",
    "host-deltas"
  ],
  "phase": "completed",
  "phases": [
    {
      "name": "classify",
      "status": "completed"
    },
    {
      "name": "preflight",
      "status": "completed"
    },
    {
      "name": "canonicalize",
      "status": "completed"
    },
    {
      "name": "render",
      "status": "completed"
    },
    {
      "name": "validate",
      "status": "completed"
    },
    {
      "name": "deploy",
      "status": "completed"
    },
    {
      "name": "verify",
      "status": "completed"
    },
    {
      "name": "receipt",
      "status": "completed"
    }
  ],
  "request_id": "b917eeb3d9b4ca9747dd7ed87c4545c6170a042eba1bc1e474ae391cc98bd45e",
  "result": "applied",
  "risk": "low",
  "schema_version": 1,
  "source": {
    "host": "canonical",
    "surface": "fleet"
  }
}
