{
  "$schema": "../../contracts/change-request.schema.json",
  "artifacts": [
    {
      "after_sha256": "e0d7562bb563bed7d23856a182f453607dd71c813b1fb3dbcb671b59d638a4ab",
      "before_sha256": "e0d7562bb563bed7d23856a182f453607dd71c813b1fb3dbcb671b59d638a4ab",
      "owner": "systematic-debugging",
      "source": "canonical"
    },
    {
      "after_sha256": "6c1e5d7b770f45fde6c78b912306a908948df9c331504882e5839e0c2755276e",
      "before_sha256": "d2aa91396eefeab2e93c117be9d42c5ee04ab4a262a93b603e0ff5703d8f3eed",
      "owner": "host-deltas",
      "source": "canonical"
    }
  ],
  "checks": [],
  "disposition": "applied",
  "machine": "local-windows",
  "operation": "deploy-canonical-owner",
  "owners": [
    "systematic-debugging",
    "host-deltas"
  ],
  "phase": "completed",
  "phases": [
    {
      "name": "classify",
      "status": "completed"
    },
    {
      "name": "preflight",
      "status": "completed"
    },
    {
      "name": "canonicalize",
      "status": "completed"
    },
    {
      "name": "render",
      "status": "completed"
    },
    {
      "name": "validate",
      "status": "completed"
    },
    {
      "name": "deploy",
      "status": "completed"
    },
    {
      "name": "verify",
      "status": "completed"
    },
    {
      "name": "receipt",
      "status": "completed"
    }
  ],
  "request_id": "64ac2b7cb5cf597fe9237ed1bc2254ca2a901e8483ebdeea4c5d067e52fc3761",
  "result": "applied",
  "risk": "low",
  "schema_version": 1,
  "source": {
    "host": "canonical",
    "surface": "fleet"
  }
}
