{
  "$schema": "../../contracts/change-request.schema.json",
  "artifacts": [
    {
      "after_sha256": "a3f53f12da8547839e6d08a18a79c9916cfa3d75449cd258becd8147dc33019c",
      "before_sha256": "a3f53f12da8547839e6d08a18a79c9916cfa3d75449cd258becd8147dc33019c",
      "owner": "frontend-ui-engineering",
      "source": "canonical"
    },
    {
      "after_sha256": "bf6997d407faf6ac9d4b9ee15a980c2c3377260e6fdb3052bba60634cb23df97",
      "before_sha256": "bb2a9d4b4cb64f7d11e37bc7df5fe25e22ed8ca88fb6ae524edf4e2e34e46359",
      "owner": "host-deltas",
      "source": "canonical"
    }
  ],
  "checks": [],
  "disposition": "applied",
  "machine": "local-windows",
  "operation": "deploy-canonical-owner",
  "owners": [
    "frontend-ui-engineering",
    "host-deltas"
  ],
  "phase": "completed",
  "phases": [
    {
      "name": "classify",
      "status": "completed"
    },
    {
      "name": "preflight",
      "status": "completed"
    },
    {
      "name": "canonicalize",
      "status": "completed"
    },
    {
      "name": "render",
      "status": "completed"
    },
    {
      "name": "validate",
      "status": "completed"
    },
    {
      "name": "deploy",
      "status": "completed"
    },
    {
      "name": "verify",
      "status": "completed"
    },
    {
      "name": "receipt",
      "status": "completed"
    }
  ],
  "request_id": "cc22ee5edcaa5c9862d08f150130af927090c258a3e1ee9fe51ad7a68a9c03df",
  "result": "applied",
  "risk": "low",
  "schema_version": 1,
  "source": {
    "host": "canonical",
    "surface": "fleet"
  }
}
