{
  "$schema": "../../contracts/change-request.schema.json",
  "artifacts": [
    {
      "after_sha256": "061fd8ec86e90ea7f9195ecd21e5a2da0a66503e98f6b0cc21cd10fe0a66e410",
      "before_sha256": "061fd8ec86e90ea7f9195ecd21e5a2da0a66503e98f6b0cc21cd10fe0a66e410",
      "owner": "frontend-ui-engineering",
      "source": "canonical"
    },
    {
      "after_sha256": "bff4f9a8c2a87d200589b45efa65ab051a93635dfaa9be6f1c58f8ab40586c4e",
      "before_sha256": "ff1561b18f720367165e2853fb8f19e708e3a9802feb15d50996b31a9600dd8e",
      "owner": "host-deltas",
      "source": "canonical"
    }
  ],
  "checks": [],
  "disposition": "applied",
  "machine": "local-windows",
  "operation": "deploy-canonical-owner",
  "owners": [
    "frontend-ui-engineering",
    "host-deltas"
  ],
  "phase": "completed",
  "phases": [
    {
      "name": "classify",
      "status": "completed"
    },
    {
      "name": "preflight",
      "status": "completed"
    },
    {
      "name": "canonicalize",
      "status": "completed"
    },
    {
      "name": "render",
      "status": "completed"
    },
    {
      "name": "validate",
      "status": "completed"
    },
    {
      "name": "deploy",
      "status": "completed"
    },
    {
      "name": "verify",
      "status": "completed"
    },
    {
      "name": "receipt",
      "status": "completed"
    }
  ],
  "request_id": "dc788b21b0de6ba5a21f3994c9f24ce854d560d01f2ad88c66be7629c5912258",
  "result": "applied",
  "risk": "low",
  "schema_version": 1,
  "source": {
    "host": "canonical",
    "surface": "fleet"
  }
}
