{
  "$schema": "../../contracts/change-request.schema.json",
  "artifacts": [
    {
      "after_sha256": "39e66f8bef82d36a87a88262e3b18f638309991d7ee3c617ff979f75f507901e",
      "before_sha256": "39e66f8bef82d36a87a88262e3b18f638309991d7ee3c617ff979f75f507901e",
      "owner": "frontend-ui-engineering",
      "source": "canonical"
    },
    {
      "after_sha256": "d28eac586ffb460f1dd330ba3dd2f232ab7f951c81b679a13a2cb16833c85cad",
      "before_sha256": "69b9997f3f9bb5664730b8b7132dd8cbd1e97a3f1cce8e46ac322a3b65f0695f",
      "owner": "host-deltas",
      "source": "canonical"
    }
  ],
  "checks": [],
  "disposition": "applied",
  "machine": "local-windows",
  "operation": "deploy-canonical-owner",
  "owners": [
    "frontend-ui-engineering",
    "host-deltas"
  ],
  "phase": "completed",
  "phases": [
    {
      "name": "classify",
      "status": "completed"
    },
    {
      "name": "preflight",
      "status": "completed"
    },
    {
      "name": "canonicalize",
      "status": "completed"
    },
    {
      "name": "render",
      "status": "completed"
    },
    {
      "name": "validate",
      "status": "completed"
    },
    {
      "name": "deploy",
      "status": "completed"
    },
    {
      "name": "verify",
      "status": "completed"
    },
    {
      "name": "receipt",
      "status": "completed"
    }
  ],
  "request_id": "a8e8a9a288a4ab59a9f7efc792483a5719df845d4e35f78700d2cedefedf42a3",
  "result": "applied",
  "risk": "low",
  "schema_version": 1,
  "source": {
    "host": "canonical",
    "surface": "fleet"
  }
}
