{
  "$schema": "../../contracts/change-request.schema.json",
  "artifacts": [
    {
      "after_sha256": "5448cc05aafc95616ade949aa080b9e1c815040b03654a894c17f3263a497347",
      "before_sha256": "5448cc05aafc95616ade949aa080b9e1c815040b03654a894c17f3263a497347",
      "owner": "instruction-authoring",
      "source": "canonical"
    },
    {
      "after_sha256": "8a21e6323e277af4976e157755b6578ef961e8e9ad5bed1295ef802027260a5a",
      "before_sha256": "eceaa3a62c4a8165675b8c0879866e6783a99647a7fb87dded5c783dbecd71d9",
      "owner": "host-deltas",
      "source": "canonical"
    }
  ],
  "checks": [],
  "disposition": "applied",
  "machine": "local-windows",
  "operation": "deploy-canonical-owner",
  "owners": [
    "instruction-authoring",
    "host-deltas"
  ],
  "phase": "completed",
  "phases": [
    {
      "name": "classify",
      "status": "completed"
    },
    {
      "name": "preflight",
      "status": "completed"
    },
    {
      "name": "canonicalize",
      "status": "completed"
    },
    {
      "name": "render",
      "status": "completed"
    },
    {
      "name": "validate",
      "status": "completed"
    },
    {
      "name": "deploy",
      "status": "completed"
    },
    {
      "name": "verify",
      "status": "completed"
    },
    {
      "name": "receipt",
      "status": "completed"
    }
  ],
  "request_id": "73cd74ee1d2de0575dcd4146d6d8fbe116dd5793a967e1b2d3d1048e24f7607a",
  "result": "applied",
  "risk": "low",
  "schema_version": 1,
  "source": {
    "host": "canonical",
    "surface": "fleet"
  }
}
