{
  "$schema": "../../contracts/change-request.schema.json",
  "artifacts": [
    {
      "after_sha256": "8da7e275ed68d09b41c30052988e1ac3925ffa64d2b4ce551e3904c89367e458",
      "before_sha256": "8da7e275ed68d09b41c30052988e1ac3925ffa64d2b4ce551e3904c89367e458",
      "owner": "frontend-ui-engineering",
      "source": "canonical"
    },
    {
      "after_sha256": "a4fdf3bf4cf82ea44aa19a49eb752eda060d461fb4622a807caa937507c3d216",
      "before_sha256": "bf6997d407faf6ac9d4b9ee15a980c2c3377260e6fdb3052bba60634cb23df97",
      "owner": "host-deltas",
      "source": "canonical"
    }
  ],
  "checks": [],
  "disposition": "applied",
  "machine": "local-windows",
  "operation": "deploy-canonical-owner",
  "owners": [
    "frontend-ui-engineering",
    "host-deltas"
  ],
  "phase": "completed",
  "phases": [
    {
      "name": "classify",
      "status": "completed"
    },
    {
      "name": "preflight",
      "status": "completed"
    },
    {
      "name": "canonicalize",
      "status": "completed"
    },
    {
      "name": "render",
      "status": "completed"
    },
    {
      "name": "validate",
      "status": "completed"
    },
    {
      "name": "deploy",
      "status": "completed"
    },
    {
      "name": "verify",
      "status": "completed"
    },
    {
      "name": "receipt",
      "status": "completed"
    }
  ],
  "request_id": "40ee2cb6314e1577a70a82d856c988a230fdeb41488f95cdb0ddbfb461046ba9",
  "result": "applied",
  "risk": "low",
  "schema_version": 1,
  "source": {
    "host": "canonical",
    "surface": "fleet"
  }
}
