{
  "$schema": "../../contracts/change-request.schema.json",
  "artifacts": [
    {
      "after_sha256": "d5aa260dbc292ba31e2437756e530cd1f4f981cc771d6564b48ab519ff9423e4",
      "before_sha256": "d5aa260dbc292ba31e2437756e530cd1f4f981cc771d6564b48ab519ff9423e4",
      "owner": "frontend-ui-engineering",
      "source": "canonical"
    },
    {
      "after_sha256": "a83a7912a092d62f13a31742f9d52bba85c49d7b79ba102578f8973a6f07603d",
      "before_sha256": "6064822c50b040b257b697b4244841ff3d1861ae6c2d40d390afe561e857b652",
      "owner": "host-deltas",
      "source": "canonical"
    }
  ],
  "checks": [],
  "disposition": "applied",
  "machine": "local-windows",
  "operation": "deploy-canonical-owner",
  "owners": [
    "frontend-ui-engineering",
    "host-deltas"
  ],
  "phase": "completed",
  "phases": [
    {
      "name": "classify",
      "status": "completed"
    },
    {
      "name": "preflight",
      "status": "completed"
    },
    {
      "name": "canonicalize",
      "status": "completed"
    },
    {
      "name": "render",
      "status": "completed"
    },
    {
      "name": "validate",
      "status": "completed"
    },
    {
      "name": "deploy",
      "status": "completed"
    },
    {
      "name": "verify",
      "status": "completed"
    },
    {
      "name": "receipt",
      "status": "completed"
    }
  ],
  "request_id": "de1530b84b0329d5bf25504f293c8cd43106649dd2faae65845a28ea03b1d28d",
  "result": "applied",
  "risk": "low",
  "schema_version": 1,
  "source": {
    "host": "canonical",
    "surface": "fleet"
  }
}
