{
  "$schema": "../../contracts/change-request.schema.json",
  "artifacts": [
    {
      "after_sha256": "7bf0ef2a12e1b70f58558bc431c8786a85d00f4841be657870c11eb53c0e4dc5",
      "before_sha256": "7bf0ef2a12e1b70f58558bc431c8786a85d00f4841be657870c11eb53c0e4dc5",
      "owner": "frontend-ui-engineering",
      "source": "canonical"
    },
    {
      "after_sha256": "1bc4a8452ec2bf7e9df1aebfbc04be5739fb0588227c79aeaccde598bcffbe15",
      "before_sha256": "1dda0e4c40c3d728bc33c49315163b0530694911659ae3345243de4377c8c404",
      "owner": "host-deltas",
      "source": "canonical"
    }
  ],
  "checks": [],
  "disposition": "applied",
  "machine": "local-windows",
  "operation": "deploy-canonical-owner",
  "owners": [
    "frontend-ui-engineering",
    "host-deltas"
  ],
  "phase": "completed",
  "phases": [
    {
      "name": "classify",
      "status": "completed"
    },
    {
      "name": "preflight",
      "status": "completed"
    },
    {
      "name": "canonicalize",
      "status": "completed"
    },
    {
      "name": "render",
      "status": "completed"
    },
    {
      "name": "validate",
      "status": "completed"
    },
    {
      "name": "deploy",
      "status": "completed"
    },
    {
      "name": "verify",
      "status": "completed"
    },
    {
      "name": "receipt",
      "status": "completed"
    }
  ],
  "request_id": "27f87830d0f1865c4e60443239639e06971950558725639ecaa67b88419c9b23",
  "result": "applied",
  "risk": "low",
  "schema_version": 1,
  "source": {
    "host": "canonical",
    "surface": "fleet"
  }
}
