{
  "$schema": "../../contracts/change-request.schema.json",
  "artifacts": [
    {
      "after_sha256": "2ad86e995b351a11832f1f7dd39097ca1c04ae2475a4e67330fb1e13ce5a90da",
      "before_sha256": "2ad86e995b351a11832f1f7dd39097ca1c04ae2475a4e67330fb1e13ce5a90da",
      "owner": "frontend-ui-engineering",
      "source": "canonical"
    },
    {
      "after_sha256": "7946e649ec4aa0849e597696aaaca436e60b40d75d88b32a8cee923b2428580d",
      "before_sha256": "b447a8b9546af490d448148a84f30e6f0981288827a154a174f5e9b22d918d46",
      "owner": "host-deltas",
      "source": "canonical"
    }
  ],
  "checks": [
    "python.exe validate.py frontend-ui-engineering"
  ],
  "disposition": "applied",
  "machine": "local-windows",
  "operation": "deploy-canonical-owner",
  "owners": [
    "frontend-ui-engineering",
    "host-deltas"
  ],
  "phase": "completed",
  "phases": [
    {
      "name": "classify",
      "status": "completed"
    },
    {
      "name": "preflight",
      "status": "completed"
    },
    {
      "name": "canonicalize",
      "status": "completed"
    },
    {
      "name": "render",
      "status": "completed"
    },
    {
      "name": "validate",
      "status": "completed"
    },
    {
      "name": "deploy",
      "status": "completed"
    },
    {
      "name": "verify",
      "status": "completed"
    },
    {
      "name": "receipt",
      "status": "completed"
    }
  ],
  "request_id": "75f7b9dbd1ac256ea00d1be3edc840f938717c731636dedf3cd3a3e39b028b8e",
  "result": "applied",
  "risk": "low",
  "schema_version": 1,
  "source": {
    "host": "canonical",
    "surface": "fleet"
  }
}
